### ISSUE TITLE
[BUG] PXE boot can't find the TFTP files

### ISSUE THREAD

**Issue by iquasere** [bluebanquise/bluebanquise#996]
I'll report this problem here since it is not related to #995. The problem is I'm a noob at this datacenter setup business, and have no idea what I'm doing.

## Context

This is my first time setting up a datacenter, as I need to do it for my current job. I am currently following the [farm datacenter tutorial](https://github.com/bluebanquise/bluebanquise/blob/master/tutorials/docs/sysadmin_servers_farm_deployment.md), using VirtualBox to set up a virtual cluster. I have very limited knowledge of networking, and it is showing here. 

## Process

Set up two VMs with VirtualBox, in the same NAT Network. Machine 1 (known in the tutorial as `odin`) was setup with the Boot ISO image available at [ Rocky Linux repository](https://rockylinux.org/download), machine 2 (`thor`) was simply setup without ISO, and boot in the following order:

![{F3614DB8-916A-4A49-BC7E-9EE881B2C102}](https://github.com/user-attachments/assets/4d1ffddf-16f4-4a1c-a195-4a77b5756abd)

Then, I followed the tutorial all the way to [running the PXE boot](https://github.com/bluebanquise/bluebanquise/blob/master/tutorials/docs/sysadmin_servers_farm_deployment.md#boot-over-pxe).

## Expected result

Something like [what](https://github.com/bluebanquise/bluebanquise/issues/994) more knowledgeable people get.

## Current result

PXE booting can't find the files required.

![394194682-474501be-cd88-4d4c-b4aa-8af201dc08d0](https://github.com/user-attachments/assets/05229409-d548-4cb2-9505-a65743c177f0)

## Possible Fix

Pray that smart people can save me and my job.

### Commands run on machine 1

`ip a`
```
1: lo: <LOOPBACK,UP,LOWER_UP> mtu 65536 qdisc noqueue state UNKNOWN group default qlen 1000
    link/loopback 00:00:00:00:00:00 brd 00:00:00:00:00:00
    inet 127.0.0.1/8 scope host lo
       valid_lft forever preferred_lft forever
    inet6 ::1/128 scope host
       valid_lft forever preferred_lft forever
2: enp0s3: <BROADCAST,MULTICAST,UP,LOWER_UP> mtu 1500 qdisc fq_codel state UP group default qlen 1000
    link/ether 08:00:27:db:94:65 brd ff:ff:ff:ff:ff:ff
    inet 10.0.2.15/24 brd 10.0.2.255 scope global dynamic noprefixroute enp0s3
       valid_lft 84988sec preferred_lft 84988sec
    inet6 fd00::a00:27ff:fedb:9465/64 scope global dynamic noprefixroute
       valid_lft 86203sec preferred_lft 14203sec
    inet6 fe80::a00:27ff:fedb:9465/64 scope link noprefixroute
       valid_lft forever preferred_lft forever
3: enp0s8: <BROADCAST,MULTICAST,UP,LOWER_UP> mtu 1500 qdisc fq_codel state UP group default qlen 1000
    link/ether 08:00:27:46:1b:69 brd ff:ff:ff:ff:ff:ff
    inet 10.10.0.1/16 brd 10.10.255.255 scope global noprefixroute enp0s8
       valid_lft forever preferred_lft forever
    inet6 fe80::f22:302c:514d:469e/64 scope link noprefixroute
       valid_lft forever preferred_lft forever
```
`tail -f /var/log/messages`
```
Dec 11 02:54:55 odin systemd[1]: systemd-tmpfiles-clean.service: Deactivated successfully.
Dec 11 02:54:55 odin systemd[1]: Finished Cleanup of Temporary Directories.
Dec 11 02:54:55 odin systemd[1]: run-credentials-systemd\x2dtmpfiles\x2dclean.service.mount: Deactivated successfully.
Dec 11 02:58:16 odin dbus-broker-launch[600]: avc:  op=setenforce lsm=selinux enforcing=0 res=1
Dec 11 02:58:41 odin dhcpd[714]: DHCPDISCOVER from 08:00:27:7e:14:7b via enp0s8
Dec 11 02:58:41 odin dhcpd[714]: DHCPOFFER on 10.10.1.1 to 08:00:27:7e:14:7b via enp0s8
Dec 11 02:58:42 odin dhcpd[714]: DHCPDISCOVER from 08:00:27:7e:14:7b via enp0s8
Dec 11 02:58:42 odin dhcpd[714]: DHCPOFFER on 10.10.1.1 to 08:00:27:7e:14:7b via enp0s8
Dec 11 02:58:44 odin dhcpd[714]: DHCPREQUEST for 10.10.1.1 (10.10.0.1) from 08:00:27:7e:14:7b via enp0s8
Dec 11 02:58:44 odin dhcpd[714]: DHCPACK on 10.10.1.1 to 08:00:27:7e:14:7b via enp0s8
```
`systemctl status atftpd`
```
● atftpd.service - ATFTP daemon with verbosity
     Loaded: loaded (/usr/lib/systemd/system/atftpd.service; enabled; preset: disabled)
     Active: active (running) since Wed 2024-12-11 02:44:08 EST; 39min ago
   Main PID: 5122 (atftpd)
      Tasks: 1 (limit: 10971)
     Memory: 232.0K
        CPU: 6ms
     CGroup: /system.slice/atftpd.service
             └─5122 /usr/sbin/atftpd --daemon --user tftp --no-multicast --maxthread 100 --group tftp /var/lib/tftpboot --verbose

Dec 11 02:44:08 odin.cluster.local atftpd[5122]:   tftp retry timeout: 5
Dec 11 02:44:08 odin.cluster.local atftpd[5122]:   maximum number of thread: 100
Dec 11 02:44:08 odin.cluster.local atftpd[5122]:   option timeout:    enabled
Dec 11 02:44:08 odin.cluster.local atftpd[5122]:   option tzise:      enabled
Dec 11 02:44:08 odin.cluster.local atftpd[5122]:   option blksize:    enabled
Dec 11 02:44:08 odin.cluster.local atftpd[5122]:   option windowsize: enabled
Dec 11 02:44:08 odin.cluster.local atftpd[5122]:   option multicast:  disabled
Dec 11 02:44:08 odin.cluster.local atftpd[5122]:      address range:  239.255.0.0-255
```
`tail -f /var/log/httpd/access_log`
```
10.10.0.1 - - [09/Dec/2024:20:03:57 -0500] "GET /repositories/centos/8/x86_64/extra/repodata/repomd.xml HTTP/1.1" 200 3077 "-" "libdnf (Rocky Linux 9.5; generic; Linux.x86_64)"
10.10.0.1 - - [09/Dec/2024:20:03:57 -0500] "GET /repositories/centos/8/x86_64/os/BaseOS/repodata/repomd.xml HTTP/1.1" 200 4164 "-" "libdnf (Rocky Linux 9.5; generic; Linux.x86_64)"
10.10.0.1 - - [09/Dec/2024:20:03:57 -0500] "GET /repositories/centos/8/x86_64/os/AppStream/repodata/repomd.xml HTTP/1.1" 200 4602 "-" "libdnf (Rocky Linux 9.5; generic; Linux.x86_64)"
10.10.0.1 - - [09/Dec/2024:23:51:25 -0500] "GET /repositories/centos/8/x86_64/extra/repodata/repomd.xml HTTP/1.1" 200 3077 "-" "libdnf (Rocky Linux 9.5; generic; Linux.x86_64)"
10.10.0.1 - - [09/Dec/2024:23:51:25 -0500] "GET /repositories/centos/8/x86_64/os/BaseOS/repodata/repomd.xml HTTP/1.1" 200 4164 "-" "libdnf (Rocky Linux 9.5; generic; Linux.x86_64)"
10.10.0.1 - - [09/Dec/2024:23:51:25 -0500] "GET /repositories/centos/8/x86_64/os/AppStream/repodata/repomd.xml HTTP/1.1" 200 4602 "-" "libdnf (Rocky Linux 9.5; generic; Linux.x86_64)"
10.10.0.1 - - [10/Dec/2024:03:39:48 -0500] "GET /repositories/centos/8/x86_64/os/AppStream/Packages/t/tftp-5.2-38.el9.x86_64.rpm HTTP/1.1" 200 32951 "-" "libdnf (Rocky Linux 9.5; generic; Linux.x86_64)"
10.10.0.1 - - [10/Dec/2024:03:53:07 -0500] "GET /repositories/centos/8/x86_64/extra/repodata/repomd.xml HTTP/1.1" 200 3077 "-" "libdnf (Rocky Linux 9.5; generic; Linux.x86_64)"
10.10.0.1 - - [10/Dec/2024:03:53:07 -0500] "GET /repositories/centos/8/x86_64/os/BaseOS/repodata/repomd.xml HTTP/1.1" 200 4164 "-" "libdnf (Rocky Linux 9.5; generic; Linux.x86_64)"
10.10.0.1 - - [10/Dec/2024:03:53:07 -0500] "GET /repositories/centos/8/x86_64/os/AppStream/repodata/repomd.xml HTTP/1.1" 200 4602 "-" "libdnf (Rocky Linux 9.5; generic; Linux.x86_64)"
```

### The NAT network as setup in VirtualBox

![{553BD394-255F-4031-98CD-8A1633490852}](https://github.com/user-attachments/assets/040d8680-ce07-416f-89c1-816332019ebb)

**Comment by oxedions** [comment]
Dear @iquasere 

Thank you for this issue.

Do not worry. We all started noob, and we are all noob to someone, nobody can be an expert in everything :blush: 

Ok, so first thing I would check here is the firewall. What is your firewall status ?

The command:

`firewall-cmd --state`

or

`systemctl status firewalld`

Should give you an answer.

An other possibility could be SELinux blocking the file sharing. I have doubt about that because atftpd does not report any connection, so my guess is the firewall :wink: 

Let me know !

**Comment by iquasere** [comment]
Thank you! Hope we can get this finally working :)

`firewall-cmd --state` -> `not running`

`systemctl status firewalld`

```
○ firewalld.service - firewalld - dynamic firewall daemon
     Loaded: loaded (/usr/lib/systemd/system/firewalld.service; disabled; preset: enabled)
     Active: inactive (dead)
       Docs: man:firewalld(1)
```
It doesn't seem to be the firewall, as per the tutorial it was already disabled/stopped. I also ran all the SELinux solutions.
```
restorecon -rv /var/www/html
restorecon -rv /var/lib/tftpboot
setenforce 0
```
So it shouldn't be SELinux. The ´thor´ server is communicating through TCP with `odin`, running `sudo tcpdump -i enp0s8 port 67 or port 68`:
```
dropped privs to tcpdump
tcpdump: verbose output suppressed, use -v[v]... for full protocol decode
listening on enp0s8, link-type EN10MB (Ethernet), snapshot length 262144 bytes
08:26:07.162441 IP 0.0.0.0.bootpc > 255.255.255.255.bootps: BOOTP/DHCP, Request from 08:00:27:7e:14:7b (oui Unknown), length 376
08:26:07.163196 IP 10.10.0.3.bootps > 255.255.255.255.bootpc: BOOTP/DHCP, Reply, length 548
08:26:07.163870 IP odin.bootps > thor.bootpc: BOOTP/DHCP, Reply, length 300
08:26:08.199425 IP 0.0.0.0.bootpc > 255.255.255.255.bootps: BOOTP/DHCP, Request from 08:00:27:7e:14:7b (oui Unknown), length 376
08:26:08.200055 IP odin.bootps > thor.bootpc: BOOTP/DHCP, Reply, length 300
08:26:08.200589 IP 10.10.0.3.bootps > 255.255.255.255.bootpc: BOOTP/DHCP, Reply, length 548
08:26:10.232245 IP 0.0.0.0.bootpc > 255.255.255.255.bootps: BOOTP/DHCP, Request from 08:00:27:7e:14:7b (oui Unknown), length 388
08:26:10.232595 IP odin.bootps > thor.bootpc: BOOTP/DHCP, Reply, length 300
```

**Comment by oxedions** [comment]
Interesting...

Can you try to get the file with the local client ?
```

[root@odin ~]# dnf install tftp
Last metadata expiration check: 2:34:52 ago on Wed 11 Dec 2024 12:28:07 PM CET.
Dependencies resolved.
============================================================================================================================================================================================================================================
 Package                                               Architecture                                            Version                                                     Repository                                                  Size
============================================================================================================================================================================================================================================
Installing:
 tftp                                                  x86_64                                                  5.2-38.el9                                                  appstream                                                   32 k

Transaction Summary
============================================================================================================================================================================================================================================
Install  1 Package

Total download size: 32 k
Installed size: 52 k
Is this ok [y/N]: y
Downloading Packages:
tftp-5.2-38.el9.x86_64.rpm                                                                                                                                                                                  128 kB/s |  32 kB     00:00    
--------------------------------------------------------------------------------------------------------------------------------------------------------------------------------------------------------------------------------------------
Total                                                                                                                                                                                                        89 kB/s |  32 kB     00:00     
Running transaction check
Transaction check succeeded.
Running transaction test
Transaction test succeeded.
Running transaction
  Preparing        :                                                                                                                                                                                                                    1/1 
  Installing       : tftp-5.2-38.el9.x86_64                                                                                                                                                                                             1/1 
  Running scriptlet: tftp-5.2-38.el9.x86_64                                                                                                                                                                                             1/1 
  Verifying        : tftp-5.2-38.el9.x86_64                                                                                                                                                                                             1/1 

Installed:
  tftp-5.2-38.el9.x86_64                                                                                                                                                                                                                    

Complete!
[root@odin ~]# tftp 10.10.0.1
tftp> get undionly.kpxe
tftp> get foo
Error code 1: File not found
tftp> quit
[root@odin ~]# 

```

Just to make sure it works from odin host itself. I did a test with a file that does not exit, foo, to ensure it works properly.

If it works from local host, another possibility I see: did you define a gateway in the dhcp server configuration ? Maybe the booting server is trying to use the gateway ?

If this still doesnt work, I have an other solution to debug, a little more "brutal" :wink:

**Comment by iquasere** [comment]
The tftp server is running fine inside the host computer - it manages to supply the `undionly.kpxe` file, and complains there is no `foo` file. But in the `/etc/dhcp/dhcpd.conf` there is no "routers" configuration.
```
#
# DHCP Server Configuration file.
#   see /usr/share/doc/dhcp-server/dhcpd.conf.example
#   see dhcpd.conf(5) man page
#
authoritative;

 option client-arch code 93 = unsigned integer 16;
 if exists client-arch {
   if option client-arch = 00:00 {
     filename "undionly.kpxe";
   } elsif option client-arch = 00:07 {
     filename "ipxe.efi";
   } elsif option client-arch = 00:08 {
     filename "ipxe.efi";
   } elsif option client-arch = 00:09 {
     filename "ipxe.efi";
   }
 }

 subnet 10.10.0.0 netmask 255.255.0.0 {
 # range 10.10.254.0 10.10.254.254; # range where unknown servers will be
 option domain-name "cluster.local";
 option domain-name-servers 10.10.0.1; # dns server ip
 option broadcast-address 10.10.255.255;
 default-lease-time 600;
 max-lease-time 7200;

 next-server 10.10.0.1; #  pxe server ip

# List of nodes

host thor {
 hardware ethernet 08:00:27:7E:14:7B;
 fixed-address 10.10.1.1;
 option host-name "thor";
}

host heimdall {
 hardware ethernet 08:00:27:8C:68:0C;
 fixed-address 10.10.2.1;
 option host-name "heimdall";
}

host valkyrie01 {
 hardware ethernet 08:00:27:C0:41:08;
 fixed-address 10.10.3.1;
 option host-name "valkyrie01";
}

host valkyrie02 {
 hardware ethernet 08:00:27:72:E2:EC;
 fixed-address 10.10.3.2;
 option host-name "valkyrie02";
}

}
```
It's like I said, I just ran the commands of the tutorial, on a fresh rocky linux VM. This one didn't even get the `fbtftp` package configured.

Lets go the brutal way.

**Comment by oxedions** [comment]
Ok !

I will try to give you info asap.

Idea is the following if you go faster than me:
Instead of booting over the network, create an EFI bootable USB image or CD ISO, and load it directly inside the client VM, and boot on that. This way, you will get an ipxe shell to debug things interactively, and start the deployment. Once deployed, you get a real client, and so you can debug the tftp stuff directly from there.

This method is used when you face some systems that refuses to boot over the network (most of the time, some very specific NIC or some stupid BIOS :blush: )

**Comment by iquasere** [comment]
I created a bootable ISO with the following commands
```
sudo apt-get install git build-essential genisoimage
git clone https://github.com/ipxe/ipxe.git
cd ipxe/src
make bin-x86_64-efi/ipxe.efi
mkdir -p iso/EFI/BOOT
cp bin-x86_64-efi/ipxe.efi iso/EFI/BOOT/bootx64.efi
genisoimage -o ipxe-boot.iso -r -J -V "iPXE" -no-emul-boot -e EFI/BOOT/bootx64.efi -iso-level 3 -D -N -R iso/
```
and uploaded it to the VM as a DVD. But booting up the machine gave the same error, it doesn't manage to find the damn file...

**Comment by oxedions** [comment]
BTW, to follow atftpd logs, please use:

```
[root@odin ~]# journalctl -u atftpd -f
Dec 12 18:56:44 odin.cluster.local atftpd[30128]: socket may listen on any address, including broadcast
Dec 12 18:56:44 odin.cluster.local atftpd[30128]: Serving undionly.kpxe to 10.10.3.1:19624
Dec 12 18:56:44 odin.cluster.local atftpd[30128]: tsize option -> 71889
Dec 12 18:56:44 odin.cluster.local atftpd[30128]: blksize option -> 1432
Dec 12 18:56:44 odin.cluster.local atftpd[30128]: Server thread exiting
Dec 12 20:49:59 odin.cluster.local atftpd[30128]: socket may listen on any address, including broadcast
Dec 12 20:49:59 odin.cluster.local atftpd[30128]: Serving undionly.kpxe to 10.10.3.1:17602
Dec 12 20:49:59 odin.cluster.local atftpd[30128]: tsize option -> 71889
Dec 12 20:49:59 odin.cluster.local atftpd[30128]: blksize option -> 1432
Dec 12 20:49:59 odin.cluster.local atftpd[30128]: Server thread exiting
^C
[root@odin ~]# 
```

So you can get all latest logs

**Comment by oxedions** [comment]
Dear @iquasere 

Any news on this issue ? :blush:

**Comment by iquasere** [comment]
Dear @oxedions,

I am in vacations, right now. On begining of January, I'll tackle these issues.

Hope you have a great passage of year. And thank you for your continuous support!

**Comment by oxedions** [comment]
Dear @iquasere 

I am closing this issue due to inactivity. Please do not hesitate to reopen the issue if this is still needed 😊
